{
  "install_mode": "local",
  "project_name": "project-name",
  "project_root": ".",
  "handyman_root": null,
  "harness_workspace": ".handyman",
  "models": {
    "leader": "editor-default",
    "implementer": "Claude Sonnet 4.6",
    "reviewer": "Claude Sonnet 4.6",
    "explorer": "Claude Sonnet 4.6"
  },
  "tools": {
    "leader": ["vscode", "execute", "read", "agent", "edit", "search", "web", "browser", "todo"],
    "implementer": ["vscode", "execute", "read", "edit", "search", "todo"],
    "reviewer": ["vscode", "execute", "read", "edit", "search", "todo"],
    "explorer": ["vscode", "execute", "read", "search", "todo"]
  }
}
